price,product_name,rating
"15,999,12,999,10,990,15,999,47,999,41,990,17,989,26,190,14,990,16,999,11,999,13,990,16,999,26,999,28,990,37,999,10,990,15,999,16,999,14,999,18,499,12,990,12,490,21,990,570,5,200","Samsung Galaxy M40 (Midnight Blue, 6GB RAM, 128GB Storage),Samsung Galaxy M30 (Gradation Blue, 4GB RAM, Super AMOLED Display, 64GB Storage, 5000mAH Battery),Vivo U10 (Electric Blue, 5000 mAH 18W Fast Charge Battery, 3GB RAM, 32GB Storage),Samsung Galaxy M40 (Midnight Blue, 6GB RAM, 128GB Storage),OnePlus 7T Pro (Haze Blue, 8GB RAM, Fluid AMOLED Display, 256GB Storage, 4085mAH Battery),OPPO Reno 10x Zoom (Ocean Green, 8GB RAM, 256 GB Storage) with No Cost EMI/Additional Exchange Offers,realme X (Space Blue, 4GB RAM, 128GB Storage),Redmi K20 Pro (Carbon Black, 6GB RAM, 128GB Storage) - Extra 2,000 Off on Exchange &12 Month No Cost EMI,OPPO F11 (Fluorite Purple, 6GB RAM, 128GB Storage) with No Cost EMI/Additional Exchange Offers,Redmi Note 8 Pro (Shadow Black, 6GB RAM, 128GB Storage with Helio G90T Processor),Redmi Note 8 (Neptune Blue, 4GB RAM, 64GB Storage),OPPO A5 2020 (Mirror Black, 4GB RAM, 64GB Storage) with No Cost EMI/Additional Exchange Offers,Redmi Note 8 Pro (Electric Blue, 6GB RAM, 128GB Storage with Helio G90T Processor),Redmi K20 Pro (Pearl White, 6GB RAM, 128GB Storage) - Extra 2,000 Off on Exchange &12 Month No Cost EMI,Samsung Galaxy Watch LTE/4G Model 46mm (Silver) 4G and Bluetooth,OnePlus 7T (Glacier Blue, 8GB RAM, Fluid AMOLED Display, 256GB Storage, 3800mAH Battery),Vivo Y12 (Aqua Blue, 3GB RAM, 64GB Storage) with No Cost EMI/Additional Exchange Offers,Redmi Note 8 Pro (Electric Blue, 6GB RAM, 64GB Storage with Helio G90T Processor),Redmi Note 8 Pro (Halo White, 6GB RAM, 128GB Storage with Helio G90T Processor),Samsung Galaxy M30s (Opal Black, 4GB RAM, 64GB Storage),Samsung Galaxy A21s (White, 6GB RAM, 64GB Storage) with No Cost EMI/Additional Exchange Offers,Vivo Y15 (Aqua Blue, 4GB RAM, 64GB Storage) with No Cost EMI/Additional Exchange,OPPO A5 2020 (Mirror Black, 3GB RAM, 64GB Storage) with No Cost EMI/Additional Exchange Offers,OPPO F15 (Lightening Black, 8GB RAM, 128GB Storage) with No Cost EMI/Additional Exchange Offers,Nillkin Frosted Ultra Thin Shield Hard Plastic Grip Back Cover Case for Samsung Galaxy A70/ Samsung A70s (Black),EVISTR L36 16gb Digital Voice Recorder for Lectures - Portable Recording Devices Voice Activated Recorders with Playback, Password","3.8 out of 5 stars,4.1 out of 5 stars,4.3 out of 5 stars,3.8 out of 5 stars,4.5 out of 5 stars,4.4 out of 5 stars,4.3 out of 5 stars,4.3 out of 5 stars,4.3 out of 5 stars,4.3 out of 5 stars,4.3 out of 5 stars,4.1 out of 5 stars,4.3 out of 5 stars,4.3 out of 5 stars,3.5 out of 5 stars,4.5 out of 5 stars,4.2 out of 5 stars,4.3 out of 5 stars,4.3 out of 5 stars,4.3 out of 5 stars,2.5 out of 5 stars,4.2 out of 5 stars,4.1 out of 5 stars,4.2 out of 5 stars,4.1 out of 5 stars"
"26,999,21,990,17,989,18,999,15,999,17,990,9,999,13,999,12,990,1,349,17,000,7,199,16,999,24,990,18,999,16,999,12,990,13,999","Redmi K20 Pro (Flame Red 6GB RAM, 128GB Storage) - Extra 2,000 Off on Exchange &12 Month No Cost EMI,Oppo F15 (Unicorn White, 8GB RAM, 128GB Storage) with No Cost EMI/Additional Exchange Offers,realme X (Space Blue, 4GB RAM, 128GB Storage),Redmi Note 8 Pro (Halo White, 8GB RAM, 128GB Storage with Helio G90T Processor),Redmi Note 8 Pro (Shadow Black, 6GB RAM, 64GB Storage with Helio G90T Processor),Vivo Y50 (Iris Blue, 8GB RAM, 128GB Storage) with No Cost EMI/Additional Exchange Offers,Samsung Galaxy M21 (Raven Black, 6GB RAM, 128GB Storage),Panasonic Eluga Ray 610 (3GB RAM, 32GB Storage) (Black),Redmi Note 9 Pro (Glacier White, 4GB RAM, 64GB Storage) - Latest Snapdragon 720G & Gorilla Glass 5 Protection,Vivo U10 (Electric Blue, 5000 mAH 18W Fast Charge Battery, 4GB RAM, 64GB Storage),Hamleys 5 Ferrari Leather Soccer Ball (Red),Xiaomi Mi A3 (Not Just Blue, 6GB RAM, 128GB Storage),IKall K10 Smartphone with K28 Keypad Mobile (Combo) (Blue),Redmi Note 9 Pro Max (Aurora Blue, 6GB RAM, 64GB Storage),Vivo V17 (Midnight Ocean, 8GB RAM, 128GB Storage) with No Cost EMI/Additional Exchange Offers,Poco F1 by Xiaomi (Armored Edition, 8GB RAM, 256GB Storage),Honor 9X (Sapphire Blue, 6+128GB Storage) -Pop up Front Camera & 48MP Triple Rear Camera,Vivo Y15 (Burgundy Red, 4GB RAM, 64GB Storage) with No Cost EMI/Additional Exchange,Redmi Note 9 Pro (Interstellar Black, 4GB RAM, 64GB Storage) - Latest Snapdragon 720G & Gorilla Glass 5 Protection","4.3 out of 5 stars,4.2 out of 5 stars,4.3 out of 5 stars,4.3 out of 5 stars,4.3 out of 5 stars,3.6 out of 5 stars,4.2 out of 5 stars,3.9 out of 5 stars,4.3 out of 5 stars,4.3 out of 5 stars,4.2 out of 5 stars,4.0 out of 5 stars,5.0 out of 5 stars,4.4 out of 5 stars,4.3 out of 5 stars,3.9 out of 5 stars,4.2 out of 5 stars,4.2 out of 5 stars"
"26,190,14,990,42,999,5,499,18,499,12,490,17,499,6,499,16,999,13,999,12,490,14,990,41,999,16,999,17,990","Redmi K20 Pro (Carbon Black, 6GB RAM, 128GB Storage) - Extra 2,000 Off on Exchange &12 Month No Cost EMI,Oppo A31 (Mystery Black, 6GB RAM, 128GB Storage) with No Cost EMI/Additional Exchange Offers,OnePlus 7 Pro (Mirror Grey, 8GB RAM, Fluid AMOLED Display, 256GB Storage, 4000mAH Battery),IKALL K9 Smartphone (6 Inch Display, 2GB Ram, 16GB Internal Storage, Dual Sim 4G Volte),University Of Washington - Small design on Black OtterBox Commuter Series Case for iPhone 6 and iPhone 6s,Samsung Galaxy A21s (Blue, 6GB RAM, 64GB Storage) with No Cost EMI/Additional Exchange Offers,OPPO A31 (Fantasy White, 4GB RAM, 64GB Storage) with No Cost EMI/Additional Exchange Offers,Xiaomi Mi A3 (More Than White, 6GB RAM, 128GB Storage),Panasonic Eluga I6 (2GB RAM, 16GB Storage) (Black),Redmi Note 9 Pro (Aurora Blue, 6GB RAM, 128GB Storage) - Latest Snapdragon 720G & Gorilla Glass 5 Protection,Honor 9X (Midnight Black, 4+128GB Storage) -Pop up Front Camera & 48MP Triple Rear Camera,OPPO A31 (Mystery Black, 4GB RAM, 64GB Storage) with No Cost EMI/Additional Exchange Offers,Vivo Y19 (Magnetic Black, 4GB RAM, 128GB Storage) with No Cost EMI/Additional Exchange Offers,OnePlus 8 5G (Glacial Green 6GB RAM+128GB Storage),Redmi Note 9 Pro (Interstellar Black, 6GB RAM, 128GB Storage) - Latest Snapdragon 720G & Gorilla Glass 5 Protection,Nokia 2.2 2/16 Black,Vivo Y50 (Pearl White, 8GB RAM, 128GB Storage) with No Cost EMI/Additional Exchange Offers","4.3 out of 5 stars,3.9 out of 5 stars,4.5 out of 5 stars,2.9 out of 5 stars,2.5 out of 5 stars,3.9 out of 5 stars,4.0 out of 5 stars,3.2 out of 5 stars,4.1 out of 5 stars,3.9 out of 5 stars,3.9 out of 5 stars,4.1 out of 5 stars,4.6 out of 5 stars,4.1 out of 5 stars,3.5 out of 5 stars,3.6 out of 5 stars"
"26,999,47,999,18,499,4,899,12,990,26,999,589,8,999,16,999,16,990,14,999,7,699,7,399,15,999,16,999,34,999,300,.,0","Redmi K20 Pro (Glacier Blue, 6GB RAM, 128GB Storage) - Extra 2,000 Off on Exchange &12 Month No Cost EMI,OnePlus 7T Pro (Haze Blue, 8GB RAM, Fluid AMOLED Display, 256GB Storage, 4085mAH Battery),Redmi Note 9 Pro Max (Glacier White, 6GB RAM, 128GB Storage),IKall K800 Smartphone (5.5 Inch, 2GB, 16GB) (Blue),Vivo U20 (Blazing Blue, Snapdragon 675 AIE, 6GB RAM, 64GB,Redmi K20 Pro (Glacier Blue, 6GB RAM, 128GB Storage) - Extra 2,000 Off on Exchange &12 Month No Cost EMI,Vruta Landline Caller ID Phone Telephone Corded Phone for Office and Home Purpose Bfone Orientel KX-T555CID,Assorted Colour,Panasonic Eluga I8 (3GB RAM, 32GB Storage) (Charcoal Black),Redmi Note 9 Pro Max (Glacier White, 6GB RAM, 64GB Storage),OPPO A52 (Twilight Black, 6GB RAM, 128GB Storage) with No Cost EMI/Additional Exchange Offers,Moto G6 (Indigo Black, 4GB RAM, 64GB Storage),IKall K500 (6.26 Inch, 4GB, 64GB) (Flame Red),IKall K2+ (5.5 Inch, 4GB, 64GB) (Ocean Blue),Redmi Note 8 Pro (Gamma Green, 6GB RAM, 64GB Storage with Helio G90T Processor),Redmi Note 9 Pro Max (Interstellar Black, 6GB RAM, 64GB Storage),OnePlus 7T (Frosted Silver, 8GB RAM, Fluid AMOLED Display, 128GB Storage, 3800mAH Battery),Phone","4.3 out of 5 stars,4.5 out of 5 stars,4.3 out of 5 stars,2.3 out of 5 stars,4.4 out of 5 stars,4.3 out of 5 stars,3.5 out of 5 stars,3.8 out of 5 stars,5.0 out of 5 stars,2.7 out of 5 stars,3.7 out of 5 stars,2.2 out of 5 stars,4.3 out of 5 stars,4.3 out of 5 stars,4.5 out of 5 stars,4.1 out of 5 stars"
"7,699,15,990,20,990,22,742,7,199,15,899,4,699,4,899,20,990,16,900,16,499,16,499,10,999,299","IKall K500 (6.26 Inch, 4GB, 64GB) (Glacier Blue),OPPO A9 2020 (Marine Green, 4GB RAM, 128GB Storage) with No Cost EMI/Additional Exchange Offers,Vivo S1 Pro (Mystic Black, 8GB RAM, 128GB Storage) with No Cost EMI/Additional Exchange Offers,Vivo V15 Pro (Topaz Blue, 6GB RAM, 128GB Storage),IKall K10 Smartphone with K28 Keypad Mobile (Combo) (Sky Blue),Samsung Galaxy A30s (Prism Crush Black, 4GB RAM, 64GB Storage) with No Cost EMI/Additional Exchange Offers,LG W10 (Smoky Gray, 3GB RAM, 32GB Storage),IKall K4 Smartphone (5.5 Inch, 2GB, 16GB),IKall K800 Smartphone (5.5 Inch, 2GB, 16GB) (Gold),Vivo S1 Pro (Jazzy Blue, 8GB RAM, 128GB Storage) with No Cost EMI/Additional Exchange Offers,Xiaomi Mi A3 (Kind of Grey, 6GB RAM, 128GB Storage),Samsung Galaxy A21s (Blue, 4GB RAM, 64GB Storage) with No Cost EMI/Additional Exchange Offers,Samsung Galaxy M11 (Metallic Blue, 4GB RAM, 64GB Storage) with No Cost EMI/Additional Exchange Offers,Samsung Galaxy M31 (Space Black, 6GB RAM, 64GB Storage),Samsung Galaxy M11 (Metallic Blue, 3GB RAM, 32GB Storage) with No Cost EMI/Additional Exchange Offers,MAGBOT Magnetic Wireless Bluetooth Headphone Earbuds Earphones Hands-Free Mic for Sports, Running, Gyming Headset Compatible with All Android Phone and iOS (Metal)","4.1 out of 5 stars,4.1 out of 5 stars,4.3 out of 5 stars,4.1 out of 5 stars,3.3 out of 5 stars,4.1 out of 5 stars,2.3 out of 5 stars,4.1 out of 5 stars,4.0 out of 5 stars,2.5 out of 5 stars,3.3 out of 5 stars,4.3 out of 5 stars,3.3 out of 5 stars"
"21,999,6,799,4,699,19,990,499,299,30,587,699,27,990,18,999,249,11,990","Samsung Galaxy A31 (Prism Crush Black, 6GB RAM, 128GB Storage) with No Cost EMI/Additional Exchange Offers,IKall K10 (6 Inch IPS Display, 4GB, 32GB) (Sky White),I Kall K5 (5.5 inch, 16GB),Huawei Y9s (Midnight Black, 6GB RAM, 128GB Storage),MAGBOT M4 K5 Smart Fitness Band for Boys/Men/Kids/Women | Waterproof Bluetooth Sports Watch Compatible with Mi, Xiaomi, Oppo, Vivo Mobile Phone | Activity Tracker Heart Rate BP Touch Screen,SBA999-B001 Wireless| Bluetooth | Headphones / Headset with Mic & Volume Button Earphone Compatible for Mi Note 5 Pro/TS Mi Note 5 Pro/mi 6 Pro/mi 6A/ mi Y2/ Mi A2,Vivo V17 Pro (Glacier Ice, 8GB RAM, 128GB Storage) with No Cost EMI/Additional Exchange Offers,Prakal Antique Telephone Corded Elegant Phone Retro Style Trimline Telephones Landline with Metal Buttons Blue Incoming-Call Flashlight for Home Hotel(Brown),Vivo V19 (Mystic Silver, 8GB RAM, 128GB Storage) with No Cost EMI/Additional Exchange Offers,Redmi Note 8 Pro (Electric Blue, 8GB RAM, 128GB Storage with Helio G90T Processor),Nokia 7.2 (Charcoal, 64 GB) (6 GB RAM),Redmi K20 Pro (Glacier Blue, 8GB RAM, 256GB Storage) - Extra 2,000 Off on Exchange &12 Month No Cost EMI,Nokia 6.2 (Ceramic Black, 4GB RAM, 64GB Storage),SBA999 F2A003 F2 | Mobile Phone / 3D Screen Magnifier / 3D Video Screen Amplifier/Eyes-Protection Enlarged Expander Support for All Smartphones (Assorted Colour),Nokia 3.2 (Black, 3GB RAM, 32GB Storage),Samsung Galaxy M21 (Midnight Blue, 6GB RAM, 128GB Storage)","3.4 out of 5 stars,3.4 out of 5 stars,3.2 out of 5 stars,4.3 out of 5 stars,4.1 out of 5 stars,4.1 out of 5 stars,4.3 out of 5 stars,3.8 out of 5 stars,4.3 out of 5 stars,3.6 out of 5 stars,2.6 out of 5 stars,3.7 out of 5 stars,4.2 out of 5 stars"
"21,999,15,899,16,999,18,499,22,788,499,499,29,499,24,990,27,990,17,990,17,907,20,990,34,999","Samsung Galaxy A31 (Prism Crush White, 6GB RAM, 128GB Storage) with No Cost EMI/Additional Exchange Offers,iPhone 4s Case, SoSoon Tough Armorbox Dual Layer Hybrid Hard/Soft Protective Case with Built-in Screen Protector for Apple iPhone 4, 4s - Amry Green,itel A44 Air (Blusher Gold, 1GB RAM, 8GB Storage),Samsung Galaxy A30s (Prism Crush White, 4GB RAM, 64GB Storage) with No Cost EMI/Additional Exchange Offers,Redmi Note 9 Pro (Glacier White, 6GB RAM, 128GB Storage) - Latest Snapdragon 720G & Gorilla Glass 5 Protection,Samsung Galaxy A21s (Black, 6GB RAM, 64GB Storage) with No Cost EMI/Additional Exchange Offers,Vivo V15 Pro (Ruby Red, 6GB RAM, 128GB Storage),MAGBOT M4 Smart Fitness Band for Boys/Men/Kids/Women | Waterproof Bluetooth Sports Watch Compatible with Mi, Xiaomi, Oppo, Vivo Mobile Phone | Activity Tracker Heart Rate and BP Monitor, Calorie Step counter OLED Touch screen,MAGBOT M4 Smart Fitness Band for Boys/Men/Kids/Women | Waterproof Bluetooth Sports Watch Compatible with Mi, Xiaomi, Oppo, Vivo Mobile Phone | Activity Tracker Heart Rate and BP Monitor, Calories, Step Counter OLED Touch screen,Apple iPhone 7 (32GB) - Black,Vivo V17 (Glacier Ice, 8GB RAM, 128GB Storage) with No Cost EMI/Additional Exchange Offers,Vivo V19 (Piano Black, 8GB RAM, 128GB Storage) with No Cost EMI/Additional Exchange Offers,Vivo S1 (Diamond Black, 6GB RAM, 64GB Storage) with No Cost EMI/Additional Exchange Offers,Honor 9X (Midnight Black, 6+128GB Storage)-Pop up Front Camera & 48MP Triple Rear Camera,Vivo S1 Pro (Dreamy White, 8GB RAM, 128GB Storage) with No Cost EMI/Additional Exchange Offers,OnePlus 7 (Mirror Grey, 8GB RAM, Optic AMOLED Display, 256GB Storage, 3700mAH Battery)","3.4 out of 5 stars,5.0 out of 5 stars,3.5 out of 5 stars,4.1 out of 5 stars,3.8 out of 5 stars,2.5 out of 5 stars,4.3 out of 5 stars,4.2 out of 5 stars,4.4 out of 5 stars,4.1 out of 5 stars,4.3 out of 5 stars,3.9 out of 5 stars,4.1 out of 5 stars,4.5 out of 5 stars"
"26,999,26,999,25,999,429,299,16,990,31,990,9,649,19,799,27,490,27,900,760,349","Redmi K20 Pro (Pearl White, 6GB RAM, 128GB Storage) - Extra 2,000 Off on Exchange &12 Month No Cost EMI,Redmi K20 Pro (Flame Red 6GB RAM, 128GB Storage) - Extra 2,000 Off on Exchange &12 Month No Cost EMI,Vivo V15 Pro (Topaz Blue, 8GB RAM, 128GB Storage),SBA999 ABM405 M4 Bluetooth Wireless Smart Fitness Band for Boys/Men/Kids/Women | Sports Watch Compatible with Xiaomi, Oppo, Vivo Mobile Phone | Heart Rate and BP Monitor, Calories Counter,SBA999-B010 |Bluetooth| Earphone Wireless Headphones for Mobile Phone Sports Stereo/Running/Gyming |Bluetooth| Headset Compatible with All Devices,Vivo S1 (Skyline Blue, 4GB RAM, 128GB Storage) with No Cost EMI/Additional Exchange Offers,Vivo V19 (Mystic Silver, 8GB RAM, 256GB Storage) with No Cost EMI/Additional Exchange Offers,Lava Z92 (Blue, 3GB RAM, 32GB Storage),iBall 2.4 Neon - Black,OPPO F11 (Jewelry White, 6GB RAM, 128GB Storage) + OPPO ENCO W31 True Wireless Earphone with Dual-Mic (White),OPPO Reno2 Z (Luminous Black, 8GB RAM, 256GB Storage) with No Cost EMI/Additional Exchange Offers,Honor 20i (Midnight Black, 128GB Storage, Triple AI Camera),Samsung Galaxy A70s (White, 8GB RAM, 128GB Storage) with No Cost EMI/Additional Exchange Offers,Prakal Telephone with Incoming Caller ID LCD Display,Home,Office,Hotel Landline Phone with 30 Incoming Memories,Poco F1 by Xiaomi (Steel Blue, 6GB RAM, SD 845, 128GB Storage),GO SHOPS G018 Wireless Bluetooth Headphones with Mic and Vol Button Earphone for All Latest Android Smartphones (Multicolor)","4.3 out of 5 stars,4.3 out of 5 stars,4.3 out of 5 stars,3.2 out of 5 stars,4.2 out of 5 stars,4.3 out of 5 stars,4.1 out of 5 stars,4.1 out of 5 stars,5.0 out of 5 stars,4.3 out of 5 stars,4.3 out of 5 stars,4.2 out of 5 stars,4.1 out of 5 stars,5.0 out of 5 stars,4.3 out of 5 stars,2.8 out of 5 stars"
"15,899,16,990,13,990,21,990,635,399,31,990,15,489,73,600,20,990,8,999,73,600","Samsung Galaxy A30s (Prism Crush Violet, 4GB RAM, 64GB Storage) with No Cost EMI/Additional Exchange Offers,Vivo Y95 (Starry Black, 4GB RAM, 64GB Storage),OPPO A5 2020 (Dazzling White, 4GB RAM, 64GB Storage) with No Cost EMI/Additional Exchange Offers,OPPO F15 (Lightening Black, 8GB RAM, 128GB Storage) with No Cost EMI/Additional Exchange Offers,realme X (Space Blue, 8GB RAM, 128GB Storage),Nillkin Super Frosted Shield Hard Back Cover Case for Redmi Note 8 - Black,SBA999 ABM404 M4 Bluetooth Wireless Smart Fitness Band for Boys/Men/Kids/Women | Sports Watch Compatible with Xiaomi, Oppo, Vivo Mobile Phone | Heart Rate and BP Monitor, Calories Counter,LG W30 (Platinum Gray, 3GB RAM, 32GB Storage),Honor 9N (Blue, 4GB RAM, 64GB Storage),Vivo V19 (Piano Black, 8GB RAM, 256GB Storage) with No Cost EMI/Additional Exchange Offers,Huawei Y9 Prime 2019 (Sapphire Blue, 4GB RAM, 128GB Storage),Redmi Note 7 Pro (Neptune Blue, 128GB, 6GB RAM),Apple iPhone 11 (128GB) - White,OPPO F11 Pro (Aurora Green, 6GB RAM, 128GB Storage) with No Cost EMI/Additional Exchange Offers,Tecno Camon iAir (5.65 inch Display) 2GB RAM + 16GB Memory,Apple iPhone 11 (128GB) - Black","4.1 out of 5 stars,4.2 out of 5 stars,4.1 out of 5 stars,4.2 out of 5 stars,4.3 out of 5 stars,5.0 out of 5 stars,3.0 out of 5 stars,3.5 out of 5 stars,4.0 out of 5 stars,4.1 out of 5 stars,4.2 out of 5 stars,4.1 out of 5 stars,4.6 out of 5 stars,4.3 out of 5 stars,3.8 out of 5 stars,4.6 out of 5 stars"
"10,990,16,490,21,990,21,999,25,250,9,990,299,19,990,15,419,1,17,100,18,490,276","LG W30 PRO (Midnight Purple, 4GB RAM, 64GB Storage, SD 632),OPPO A7 (Glaring Gold, 3GB RAM, 64GB Storage),Honor 8X (Blue, 4GB RAM, 64GB Storage),Oppo F15 (Unicorn White, 8GB RAM, 128GB Storage) with No Cost EMI/Additional Exchange Offers,Samsung Galaxy A31 (Prism Crush Blue, 6GB RAM, 128GB Storage) with No Cost EMI/Additional Exchange Offers,Samsung Galaxy A51 (Black, 6GB RAM, 128GB Storage) with No Cost EMI/Additional Exchange Offers,OPPO A12 (Blue, 3GB RAM, 32GB Storage) with No Cost EMI/Additional Exchange Offers,SBA999-B009 |Bluetooth| Earphone Wireless/Headphones/for Mobile/Phone Sports/Stereo Jogger/Running/Gyming |Bluetooth| Headset Compatible with All Devices,Samsung Galaxy A50s (Prism Crush White, 6GB RAM, 128GB Storage),Huawei Y9s (Breathing Crystal, 6GB RAM, 128GB Storage),Moto G6 (Indigo Black, 3GB RAM, 32GB Storage),Huawei Y9 Prime 2019 (Emerald Green, 4GB RAM, 128GB Storage),Fermata Portable LED Music Light with Carry Case and Batteries,Apple iPhone 11 Pro Max (64GB) - Midnight Green,Oppo A9 2020 (Vanilla Mint, 8GB RAM, 128GB Storage) with No CostEMI/Additional Exchange Offers,SBA999-A001 Metal Lazy Stand Bracket Mobile Phone Stand | Flexible | Portable - Foldable | 360 Degree | Gooseneck Long Arm Clip-((Color May Vary)","4.6 out of 5 stars,4.2 out of 5 stars,4.3 out of 5 stars,4.2 out of 5 stars,3.4 out of 5 stars,4.2 out of 5 stars,3.6 out of 5 stars,4.5 out of 5 stars,4.1 out of 5 stars,3.4 out of 5 stars,3.7 out of 5 stars,4.2 out of 5 stars,4.6 out of 5 stars,4.5 out of 5 stars,4.1 out of 5 stars,3.1 out of 5 stars"
"15,556,18,570,399,24,999,68,300,276,258,26,190,399,29,999,499,18,990","10.or Crafted for Amazon G2 (Charcoal Black, 6GB RAM, 64GB Storage),Samsung Galaxy A50s (Prism Crush White, 4GB RAM, 128GB Storage) with No Cost EMI/Additional Exchange Offers,SBA999 ABM403 M4 Bluetooth Wireless Smart Fitness Band for Boys/Men/Kids/Women | Sports Watch Compatible with Xiaomi, Oppo, Vivo Mobile Phone | Heart Rate and BP Monitor, Calories Counter,Apple iPhone 6s (32GB) - Rose Gold,Apple iPhone 11 (64GB) - Purple,SBA999-A005 Flexible 360° Universal |Mobile Phone| Long Arm Neck Lazy Stand/Bracket Holder Compatible with All Smartphones - Assorted Colors,SBA999-A007 Universal Neck Lazy| Smartphone| Holder -Flexible and Adjustable/DIY Hands-Free 360’ Rotation/Mount for Smart Device,Redmi K20 Pro (Carbon Black, 6GB RAM, 128GB Storage) - Extra 2,000 Off on Exchange &12 Month No Cost EMI,Vivo Y31L (White),SBA999 ABM412 M4 Bluetooth Wireless Smart Fitness Band for Boys/Men/Kids/Women | Sports Watch Compatible with Xiaomi, Oppo, Vivo Mobile Phone | Heart Rate and BP Monitor, Calories Counter,Honor 9N (Black, 4GB RAM, 128GB Storage),Redmi K20 Pro (Carbon Black, 8GB RAM, 256GB Storage) - Extra 2,000 Off on Exchange &12 Month No Cost EMI,MAGBOT M4 Zx2 Smart Fitness Band for Boys/Men/Kids/Women | Waterproof Bluetooth Sports Digital Watch Compatible with Mi, Xiaomi, Oppo, Vivo Mobile Phone | Activity Tracker Heart Rate BP Touch Screen,Tecno CAMON i4 (Triple Camera ON DOT Notch); 4GB+64GB Memory (Champagne Gold),Kechaoda K33 Slim Card Size Light Weight and Stylish Dual Sim GSM Mobile Phone (Rose Gold),Vivo S1 (Skyline Blue, 6GB RAM, 64GB Storage) with No Cost EMI/Additional Exchange Offers","3.8 out of 5 stars,4.1 out of 5 stars,3.1 out of 5 stars,4.0 out of 5 stars,4.6 out of 5 stars,3.3 out of 5 stars,2.7 out of 5 stars,4.3 out of 5 stars,3.7 out of 5 stars,3.2 out of 5 stars,4.0 out of 5 stars,4.3 out of 5 stars,5.0 out of 5 stars,3.8 out of 5 stars,4.3 out of 5 stars"
"54,999,12,500,27,999,12,398,49,999,770,18,990,689,5,300","Mi 10 (Twilight Grey, 8GB RAM, 256GB Storage) - 108MP Quad Camera, SD 865 Processor, 5G Ready,Nokia 3.1 (Blue, 32GB),Samsung Galaxy A51 (White, 8GB RAM, 128GB Storage) with No Cost EMI/Additional Exchange Offers,Nokia 3.2 (Steel, 3GB RAM, 32GB Storage),Mi 10 (Twilight Grey, 8GB RAM, 128GB Storage) - 108MP Quad Camera, SD 865 Processor, 5G Ready,Nokia 7.1_BL (Blue, 4GB, 64GB Storage),Mixen Orientel KX-T777 Landline Phone Telephone Corded Phone for Office and Home Purpose_Brown,OPPO A9 2020 (Marine Green, 8GB RAM, 128GB Storage) with No Cost EMI/Additional Exchange Offers,Honor 20i (Phantom Blue, 128GB Storage, Triple AI Camera),BlackBerry Evolve (Black),iBall 2.4M Gripper - Black+Red,KXD W50 4G Volte, Battery 2100mAh Dual Sim with 8MP+5MP,5.0 inch 1GB RAM+8GB ROM (Black),Glive KX-T555 Plastic Corded Phone (White, 19x8x7cm),Moto E6s (Caribbean Blue, 64 GB) (4 GB RAM),Surya Oxiron Model X4 16 GB with 2 GB RAM and Reliance Jio 4G Sim (White),Moto E5 XT1944-5 (Flash Grey, 16GB)","3.6 out of 5 stars,3.6 out of 5 stars,4.2 out of 5 stars,3.7 out of 5 stars,3.6 out of 5 stars,3.5 out of 5 stars,4.0 out of 5 stars,4.1 out of 5 stars,4.2 out of 5 stars,3.2 out of 5 stars,5.0 out of 5 stars,5.0 out of 5 stars,3.4 out of 5 stars,3.0 out of 5 stars,4.1 out of 5 stars"
"49,999,11,777,22,999,4,699,645,89,900,1,21,300,385,18,499,276","Motorola G5s Plus (Blush Gold, 64GB),Mi 10 (Coral Green, 8GB RAM, 128GB Storage) - 108MP Quad Camera, SD 865 Processor, 5G Ready,Nokia 3.1 Plus (White, 3GB RAM, 32GB Storage),Honor 20 (Midnight Black, 6GB, 128GB Storage) - 48m AI Quad Rear Camera & Kirin 980 Processor.,Mobiistar X1 Notch Gradient Shine (2GB-16GB),IKall K110 (5.5 Inch, 2GB, 16GB, 4G Volte) (Blue),Nillkin Case for Apple iPhone 11 Pro Max (6.5"" Inch) Super Frosted Hard Back Cover PC with Logo Cut Black Color,Apple iPhone Xs Max (256GB) - Gold,IKALL K1 5 inch 4G Android Phone with Freebie Grip/Stand - Black,Redmi Note 7 Pro (Space Black, 128GB, 6GB RAM),Apple iPhone 11 Pro (256GB) - Midnight Green,Lenovo K10 Note (Black, 64 GB) (4 GB RAM),Remixmart M4 Bluetooth Wireless Smart Fitness Band for Boys/Men/Kids/Women | Sports Watch Compatible with Xiaomi, Oppo, Vivo Mobile Phone | Heart Rate and BP Monitor, Calories Counter by RemixmartTM,Redmi Note 9 Pro Max (Interstellar Black, 6GB RAM, 128GB Storage),Coolpad Max A-8 (Gold),SBA999-A006 Metal Lazy Stand Bracket/Mobile Phone Stand | Flexible | Portable - Foldable | 360 Degree | Gooseneck Long Arm Clip","3.8 out of 5 stars,3.6 out of 5 stars,3.6 out of 5 stars,4.4 out of 5 stars,3.2 out of 5 stars,4.0 out of 5 stars,4.3 out of 5 stars,1.0 out of 5 stars,4.2 out of 5 stars,4.5 out of 5 stars,3.8 out of 5 stars,2.3 out of 5 stars,3.9 out of 5 stars,3.2 out of 5 stars,3.3 out of 5 stars"
"25,250,5,900,14,490,27,490,9,999,899,73,600,17,175,68,300,14,770,28,000,4,889","Samsung Galaxy A51 (White, 6GB RAM, 128GB Storage) with No Cost EMI/Additional Exchange Offers,SHIVANSH OBI Worldphone Phone MV1 (2 GB RAM, 16 GB Internal Storage, White) (Black),(Renewed) Samsung Galaxy A50 (Blue, 6GB RAM, 64GB Storage) with Offer,Mi Note 7 Pro Phone (Space Black, 64GB, 6GB RAM),OPPO Reno2 Z (Sky White, 8GB RAM, 256GB Storage) with No Cost EMI/Additional Exchange Offers,IKALL K1 5 inch 4G Android Phone with Freebie Grip/Stand - Black,Mobiistar X1 Notch Sapphire Blue (3GB+32GB),The Perfect Lifestyles Caller ID Landline Big Phone Corded for Home and Office Purpose Multi Color,Apple iPhone 11 (128GB) - (Product) RED,Xiaomi Redmi Mi Redmi Note 7S Phone (Sapphire Blue, 32GB, 3GB RAM),Honor 9X (Sapphire Blue, 6GB RAM, 128GB Storage),MOBPROOF The Fashional Color Waterproof Case for iPhone 4/4s Teal,Apple iPhone 11 (64GB) - White,HTC One X9 Smart Phone, Carbon Grey,Samsung Galaxy A70s (Red, 8GB RAM, 128GB Storage) with No Cost EMI/Additional Exchange Offers,ZEBRONICS Video Door Phone with 7 inch Screen (ZEB-VD7WR)","4.2 out of 5 stars,3.3 out of 5 stars,3.1 out of 5 stars,4.0 out of 5 stars,4.3 out of 5 stars,1.0 out of 5 stars,3.2 out of 5 stars,4.6 out of 5 stars,4.0 out of 5 stars,4.3 out of 5 stars,4.0 out of 5 stars,4.6 out of 5 stars,2.9 out of 5 stars,4.1 out of 5 stars,4.1 out of 5 stars"
